po_number,po_version,status,issued_date,valid_from,valid_to,issued_by,issued_by_title,issued_by_email,approved_by,approved_by_title,approved_by_email,department,cost_center,budget_code,vendor_name,vendor_id,contract_reference,line_items,currency,total_authorized_monthly,total_authorized_annual,payment_terms,payment_method,notes,supersedes_po,superseded_by_po,amendment_reason
PO-MH-2023-0847,1.0,superseded,2023-10-30,2023-11-01,2024-10-31,James Park,Procurement Director,j.park@meridianhealth.com,Sarah Chen,VP Engineering,s.chen@meridianhealth.com,Engineering + Marketing (combined),CC-4200-TECH,BUD-2023-INFRA-042,Athena Cloud BV,VEND-AC-0091,CTR-2023-MH-001,"25 Engineering seats (Growth) @ €7,400/seat/yr; 25 Marketing seats (Marketing Ops) @ €6,480/seat/yr; 5% loyalty discount applied",EUR,15069.17,180830.00,Net 30,SEPA Credit Transfer,"Initial Athena Cloud contract. Single PO covering both Engineering and Marketing departments under the Technology cost center. Approved by Sarah Chen (VP Engineering at time of signing). James Park noted: 'Simple single PO for now. If departments need separate budget tracking, we'll split later.'",,PO-MH-2024-1203,
PO-MH-2024-1203,1.0,superseded,2024-11-20,2024-11-01,2025-10-31,James Park,Procurement Director,j.park@meridianhealth.com,Margaret Walsh,CFO,m.walsh@meridianhealth.com,Engineering + Marketing (combined),CC-4200-TECH,BUD-2024-INFRA-019,Athena Cloud BV,VEND-AC-0091,CTR-2024-MH-002,"25 Engineering seats (Enterprise) @ €9,800/seat/yr; 12 Marketing seats (Growth) @ €7,400/seat/yr; 5% loyalty discount applied",EUR,18583.58,223002.96,Net 30,SEPA Credit Transfer,Year 2 renewal. Engineering upgraded to Enterprise tier. Marketing reduced from 25 to 12 seats. Margaret Walsh (CFO) required as approver for all vendor POs above €50K — first PO she personally approved for Athena Cloud. Margaret's comment during approval: 'The engineering utilization justifies this. The marketing seats need review in 6 months.' James noted that Margaret reviewed every line item and asked why marketing still had 12 seats when utilization was 48%.,PO-MH-2023-0847,PO-MH-2026-0045-ENG; PO-MH-2026-0046-MKT,Year 2 renewal. Engineering upgrade to Enterprise. Marketing seat reduction (25→12).
PO-MH-2024-1203,1.1,superseded,2025-10-28,2025-11-01,2026-10-31,James Park,Procurement Director,j.park@meridianhealth.com,Margaret Walsh,CFO,m.walsh@meridianhealth.com,Engineering + Marketing (combined),CC-4200-TECH,BUD-2025-INFRA-019,Athena Cloud BV,VEND-AC-0091,CTR-2024-MH-002,"25 Engineering seats (Enterprise) @ €9,800/seat/yr; 12 Marketing seats (Growth) @ €7,400/seat/yr; 5% loyalty discount applied",EUR,18583.58,223002.96,Net 30,SEPA Credit Transfer,PO amendment: validity extended per contract auto-renewal (Year 3). Same terms. Margaret approved but added a note: 'Renewing under existing terms. I expect a formal vendor review in Q1 2026 including utilization audit and competitive benchmarking. Next renewal will not be automatic.' James forwarded Margaret's note to Elena (then AM).,,PO-MH-2026-0045-ENG; PO-MH-2026-0046-MKT,Contract auto-renewal. Validity extended to Oct 2026. Terms unchanged.
PO-MH-2026-0045-ENG,1.0,active,2026-01-20,2026-01-01,2026-10-31,James Park,Procurement Director,j.park@meridianhealth.com,David Wu,VP Engineering,d.wu@meridianhealth.com,Engineering,CC-4210-ENG,BUD-2026-ENG-MONITORING-001,Athena Cloud BV,VEND-AC-0091,CTR-2024-MH-002,"25 Engineering seats (Enterprise) @ €9,800/seat/yr; 5% loyalty discount; engineering share = 75% of total monthly invoice",EUR,13937.69,167252.28,Net 30,SEPA Credit Transfer,"NEW: Department-specific PO per Margaret Walsh's directive (Jan 2026). Engineering department now pays from its own budget (CC-4210-ENG) rather than the combined Technology cost center. Approved by David Wu as department head. David approved immediately — 'This is the most valuable tool my team uses. Happy to own the budget line.' Monthly amount = 75% of total invoice (€18,583.58 × 0.75 = €13,937.69). Discounted months (e.g., SLA credits) will be split proportionally. James instructed Athena Cloud (Tomás Herrera, new AM) to expect two separate SEPA transfers per invoice.",PO-MH-2024-1203 (engineering portion),,CFO-mandated department-level vendor cost tracking. Engineering budget separated from combined Technology cost center.
PO-MH-2026-0046-MKT,1.0,active,2026-01-22,2026-01-01,2026-10-31,James Park,Procurement Director,j.park@meridianhealth.com,Lisa Huang,Marketing Ops Manager,l.huang@meridianhealth.com,Marketing,CC-4220-MKT,BUD-2026-MKT-TOOLS-003,Athena Cloud BV,VEND-AC-0091,CTR-2024-MH-002,"12 Marketing seats (Growth) @ €7,400/seat/yr; 5% loyalty discount; marketing share = 25% of total monthly invoice",EUR,4645.89,55750.68,Net 30,SEPA Credit Transfer,"NEW: Department-specific PO per Margaret Walsh's directive. Marketing department now pays from its own budget (CC-4220-MKT). Lisa Huang signed as department approver but added a handwritten note on the approval form: 'Approving under protest. We are paying for 12 seats and only 5 are active. I have raised this issue multiple times (Nov 2024 email, support tickets TKT-4903, TKT-4909, Aug 2025 voicemail to Elena). Nobody has addressed it. I am approving this PO to avoid disrupting Engineering but I want it on record that Marketing is overpaying by approximately €3,100/month for unused seats.' James scanned Lisa's note and forwarded to Margaret with comment: 'FYI — Lisa raises a valid point. This should be addressed in the Q1 vendor review.' Margaret replied: 'Noted. Add to the review agenda.'",PO-MH-2024-1203 (marketing portion),,CFO-mandated department-level vendor cost tracking. Marketing budget separated. Lisa Huang's protest note attached regarding unused seat overpayment.
